{
  "$schema": "https://json-schema.org/draft/2020-12/schema",
  "$id": "card.schema.json",
  "title": "Card",
  "type": "object",
  "additionalProperties": false,
  "required": [
    "id",
    "term",
    "aliases",
    "difficulty",
    "definition",
    "categories"
  ],
  "properties": {
    "id": {
      "type": "string",
      "pattern": "^[a-z0-9]+(?:-[a-z0-9]+)*$",
      "maxLength": 96
    },
    "term": {
      "type": "string",
      "minLength": 1,
      "maxLength": 80
    },
    "aliases": {
      "type": "array",
      "maxItems": 8,
      "items": {
        "type": "string",
        "minLength": 1,
        "maxLength": 80
      }
    },
    "prompt": {
      "type": "string",
      "minLength": 1,
      "maxLength": 160
    },
    "difficulty": {
      "enum": [
        "fundamental",
        "intermediate",
        "advanced"
      ]
    },
    "definition": {
      "type": "string",
      "minLength": 40,
      "maxLength": 600
    },
    "purpose": {
      "type": "string",
      "minLength": 1,
      "maxLength": 280
    },
    "details": {
      "type": "array",
      "maxItems": 5,
      "items": {
        "type": "string",
        "minLength": 1,
        "maxLength": 200
      }
    },
    "complexity": {
      "type": "object",
      "additionalProperties": false,
      "properties": {
        "time": {
          "type": "string",
          "minLength": 1,
          "maxLength": 240
        },
        "space": {
          "type": "string",
          "minLength": 1,
          "maxLength": 240
        }
      }
    },
    "examples": {
      "type": "array",
      "maxItems": 6,
      "items": {
        "type": "string",
        "minLength": 1,
        "maxLength": 120
      }
    },
    "sketch": {
      "type": "string",
      "minLength": 1,
      "maxLength": 500
    },
    "categories": {
      "type": "array",
      "minItems": 1,
      "items": {
        "type": "string",
        "pattern": "^[a-z0-9]+(?:-[a-z0-9]+)*$",
        "maxLength": 96
      }
    }
  }
}
